{
  "$ref": "#/definitions/projects",
  "definitions": {
    "projects": {
      "type": "object",
      "properties": {
        "title": {
          "type": "string"
        },
        "slug": {
          "type": "string"
        },
        "cover": {
          "type": "string"
        },
        "blocks": {
          "type": "array",
          "items": {
            "anyOf": [
              {
                "type": "object",
                "properties": {
                  "type": {
                    "type": "string",
                    "const": "image"
                  },
                  "src": {
                    "type": "string"
                  },
                  "width": {
                    "type": "number",
                    "enum": [
                      6,
                      12
                    ]
                  }
                },
                "required": [
                  "type",
                  "src"
                ],
                "additionalProperties": false
              },
              {
                "type": "object",
                "properties": {
                  "type": {
                    "type": "string",
                    "const": "text"
                  },
                  "content": {
                    "type": "string"
                  }
                },
                "required": [
                  "type",
                  "content"
                ],
                "additionalProperties": false
              },
              {
                "type": "object",
                "properties": {
                  "type": {
                    "type": "string",
                    "const": "p5"
                  },
                  "url": {
                    "type": "string"
                  }
                },
                "required": [
                  "type"
                ],
                "additionalProperties": false
              }
            ]
          }
        },
        "$schema": {
          "type": "string"
        }
      },
      "required": [
        "title",
        "slug",
        "cover",
        "blocks"
      ],
      "additionalProperties": false
    }
  },
  "$schema": "http://json-schema.org/draft-07/schema#"
}