{
  "title": "Пример проекта",
  "slug": "example",
  "cover": "/images/example-cover.webp",
  "blocks": [
    {
      "type": "text",
      "content": "# Пример проекта\n\nЭто пример проекта в портфолио. Здесь можно описать проект, его концепцию и процесс работы."
    },
    {
      "type": "image",
      "src": "/images/example-1.webp",
      "width": 12
    },
    {
      "type": "image",
      "src": "/images/example-2.webp",
      "width": 6
    },
    {
      "type": "image",
      "src": "/images/example-3.webp",
      "width": 6
    },
    {
      "type": "p5",
      "url": "/sketches/example/index.html"
    }
  ]
}
